{
  "schema_version": 1,
  "id": "WDT-20260711T073711Z-4EAF9E",
  "title": "Prefer GitHub issues or PRs as canonical task descriptions (#1)",
  "repo": "ChaoWao/wuditask",
  "created_by": {
    "login": "ChaoWao",
    "github_id": 26245345
  },
  "owner": {
    "login": "ChaoWao",
    "github_id": 26245345
  },
  "priority": "P1",
  "created_at": "2026-07-11T07:37:11Z",
  "goal": "Make WudiTask agent workflows use an existing or newly created GitHub Issue/PR as the canonical problem description whenever an owning repository is clear, with text-only descriptions reserved for cases without a suitable repository.",
  "context": [
    "Canonical requirements: https://github.com/ChaoWao/wuditask/issues/1. Keep structured WudiTask goal/context/acceptance fields as a concise execution contract and store the canonical URL in links; do not add hidden remote mutations to the deterministic Python add command. This maintenance request originated while working in hw-native-sys/simpler at main@9c752a7d; leave that repository and its task state untouched."
  ],
  "acceptance_criteria": [
    {
      "id": "AC-1",
      "description": "The operational WudiTask skill makes Issue/PR-first discovery or creation mandatory when an owning GitHub repository is clear, uses text-only description only when no suitable repository exists, stores the canonical URL in links, and applies the same rule to selfupdate fix without dropping required structured task fields.",
      "verification": {
        "type": "command",
        "value": "python3 -m unittest tests.test_install tests.test_selfupdate"
      }
    },
    {
      "id": "AC-2",
      "description": "Read-only CLI help for add, workflow, and selfupdate exposes the Issue/PR-first policy and remains non-mutating.",
      "verification": {
        "type": "command",
        "value": "python3 -m unittest tests.test_cli"
      }
    },
    {
      "id": "AC-3",
      "description": "README, workflow, protocol/data-format guidance, and examples consistently distinguish the canonical Issue/PR narrative from the concise WudiTask execution contract; all tests and local data validation pass.",
      "verification": {
        "type": "command",
        "value": "python3 -m unittest && python3 tools/wuditask.py --local validate"
      }
    }
  ],
  "dependencies": [],
  "claim": {
    "token": "0afb05e8e8674000944699f5437b1429",
    "github_login": "ChaoWao",
    "github_id": 26245345,
    "claimed_at": "2026-07-11T07:37:23Z"
  },
  "links": [
    "https://github.com/ChaoWao/wuditask/issues/1"
  ],
  "completion": {
    "outcome": "cancelled",
    "completed_at": "2026-07-11T07:38:57Z",
    "completed_by": {
      "login": "ChaoWao",
      "github_id": 26245345
    },
    "result": "Superseded after user clarification: direct WudiTask maintenance must not be represented as a WudiTask task or automatic GitHub Issue.",
    "acceptance_results": [
      {
        "criterion_id": "AC-1",
        "status": "skipped",
        "evidence": "Superseded after user clarification: direct WudiTask maintenance must not be represented as a WudiTask task or automatic GitHub Issue."
      },
      {
        "criterion_id": "AC-2",
        "status": "skipped",
        "evidence": "Superseded after user clarification: direct WudiTask maintenance must not be represented as a WudiTask task or automatic GitHub Issue."
      },
      {
        "criterion_id": "AC-3",
        "status": "skipped",
        "evidence": "Superseded after user clarification: direct WudiTask maintenance must not be represented as a WudiTask task or automatic GitHub Issue."
      }
    ]
  }
}
